{
  "schema_version": "origami.model-manifest.v1",
  "model": {
    "id": "unsloth/Qwen3.8-Flash-Next-GGUF",
    "revision": "d3bc75ee6ccef3efc1e228ec00a6cc2cdb1e2249",
    "format": "GGUF",
    "quantization": "UD-IQ1_S",
    "source": "https://huggingface.co/unsloth/Qwen3.8-Flash-Next-GGUF/tree/d3bc75ee6ccef3efc1e228ec00a6cc2cdb1e2249/UD-IQ1_S"
  },
  "entrypoint": "Qwen3.8-Flash-Next-UD-IQ1_S-00001-of-00003.gguf",
  "shards": [
    {
      "path": "Qwen3.8-Flash-Next-UD-IQ1_S-00001-of-00003.gguf",
      "size_bytes": 10946624,
      "sha256": "88a1420825a9304063e882ada29d438263617f51ac8923d438d927496693bafd"
    },
    {
      "path": "Qwen3.8-Flash-Next-UD-IQ1_S-00002-of-00003.gguf",
      "size_bytes": 49990818368,
      "sha256": "3a62e35bbf9add4733bd1438ebd3a67649d5edd6cb0e72bb78e33c913992b2b6"
    },
    {
      "path": "Qwen3.8-Flash-Next-UD-IQ1_S-00003-of-00003.gguf",
      "size_bytes": 22544696352,
      "sha256": "0e25ceaeb89b8a80aa973c6c0c7448943682f7408c2855b2ebd016b7643a861a"
    }
  ]
}
